{
  "id": "p3-m5-l1",
  "phase": 3,
  "modul": "3.5 Speicher für Fortgeschrittene",
  "titel": "Allokatoren und Polymorphic Memory Resources",
  "lernziele": [
    "Verstehen, wie Container Speicher über Allokatoren anfordern",
    "Mit `std::pmr` Container auf eigenen Speicher umleiten",
    "Monotone und Pool-Ressourcen gezielt einsetzen"
  ],
  "dauerMinuten": 7,
  "schritte": [
    {
      "typ": "multiple-choice",
      "frage": "Woher bekommt ein `std::vector<int>` seinen Speicher?",
      "optionen": [
        "Über seinen Allokator, standardmässig `std::allocator<int>`, der `operator new` aufruft",
        "Immer direkt vom Stack",
        "Über `malloc`, das kann man nicht ändern"
      ],
      "korrekt": 0,
      "erklaerung": "Jeder Standardcontainer hat einen Template-Parameter für den **Allokator**. Damit lässt sich die Speicherquelle austauschen. Klassische Allokatoren sind aber Teil des Typs: `std::vector<int, MeinAllokator>` ist ein anderer Typ als `std::vector<int>` und lässt sich nicht an dieselbe Funktion übergeben. Das macht sie unhandlich.",
      "begruendungen": [
        "Richtig.",
        "Der Inhalt eines Vektors liegt nie im Vektorobjekt selbst.",
        "Gerade der Allokator-Parameter macht das austauschbar."
      ]
    },
    {
      "typ": "erklaerung",
      "titel": "std::pmr",
      "text": "Mit C++17 kamen **Polymorphic Memory Resources** in `<memory_resource>`. Die Container in `std::pmr` (`pmr::vector`, `pmr::string`, `pmr::map`) haben alle denselben Allokatortyp. Welche Speicherquelle sie verwenden, entscheidet ein Zeiger auf eine `std::pmr::memory_resource` zur Laufzeit.\n\nMitgeliefert werden:\n\n- **`monotonic_buffer_resource`**: verteilt Speicher fortlaufend aus einem Puffer und gibt erst am Ende alles auf einmal frei. Extrem schnell.\n- **`unsynchronized_pool_resource`** / **`synchronized_pool_resource`**: Pools für verschiedene Blockgrössen.\n- **`null_memory_resource()`**: wirft bei jeder Anforderung. Gut als Sicherung.\n\nEigene Ressourcen leitet man von `memory_resource` ab."
    },
    {
      "typ": "code-lesen",
      "frage": "Was passiert in diesem Code?",
      "code": {
        "sprache": "cpp",
        "zeilen": [
          "std::array<std::byte, 4096> puffer;",
          "std::pmr::monotonic_buffer_resource arena{puffer.data(), puffer.size(),",
          "                                         std::pmr::null_memory_resource()};",
          "",
          "std::pmr::vector<std::pmr::string> namen{&arena};",
          "namen.emplace_back(\"Temperatursensor am Motorgehaeuse\");",
          "namen.emplace_back(\"Drucksensor\");"
        ]
      },
      "optionen": [
        "Vektor und Strings holen ihren Speicher aus dem 4-KB-Puffer auf dem Stack. Reicht er nicht, wird eine Exception geworfen statt auf den Heap auszuweichen",
        "Die Strings landen auf dem Heap, nur der Vektor im Puffer",
        "Der Puffer wird bei jedem `emplace_back` geleert"
      ],
      "korrekt": 0,
      "erklaerung": "pmr-Container geben ihre Ressource an ihre Elemente weiter (*allocator propagation*). Darum landen auch die Strings im Puffer. Die `null_memory_resource` als Rückfall verhindert, dass still auf den Heap ausgewichen wird. Ohne sie wäre der Standard `new_delete_resource()`.",
      "begruendungen": [
        "Richtig.",
        "pmr-Strings in einem pmr-Vektor übernehmen dessen Ressource.",
        "Eine monotone Ressource gibt erst frei, wenn sie selbst zerstört wird."
      ]
    },
    {
      "typ": "fehler-finden",
      "frage": "Dieser Code verwendet eine monotone Ressource für eine Schleife, die stundenlang läuft. Nach einer Weile kommt `std::bad_alloc`. Welche Zeile ist das Problem?",
      "code": {
        "sprache": "cpp",
        "zeilen": [
          "std::pmr::monotonic_buffer_resource arena{puffer.data(), puffer.size(),",
          "                                         std::pmr::null_memory_resource()};",
          "",
          "while (true) {",
          "    std::pmr::vector<Messwert> werte{&arena};",
          "    sammle(werte);",
          "    sende(werte);",
          "}"
        ]
      },
      "fehlerZeile": 1,
      "erklaerung": "Eine monotone Ressource gibt einzelne Freigaben nicht zurück. Jeder Durchlauf verbraucht neuen Speicher aus dem Puffer, bis er leer ist. Richtig: die Ressource in die Schleife verschieben, damit sie pro Durchlauf neu beginnt, oder `arena.release()` am Ende jedes Durchlaufs aufrufen. Für langlebige Container mit vielen Freigaben passt eine Pool-Ressource."
    },
    {
      "typ": "zuordnen",
      "frage": "Welche Ressource passt?",
      "paare": [
        { "links": "Pro Anfrage viele kleine Objekte, danach alles weg", "rechts": "`monotonic_buffer_resource` pro Anfrage" },
        { "links": "Langlebige Map mit vielen Einfügungen und Löschungen", "rechts": "`unsynchronized_pool_resource`" },
        { "links": "Mehrere Threads teilen sich die Ressource", "rechts": "`synchronized_pool_resource`" },
        { "links": "Sicherstellen, dass nie auf den Heap ausgewichen wird", "rechts": "`null_memory_resource()` als Rückfall" }
      ],
      "erklaerung": "Monotone Ressourcen sind ideal für einen „Arena“-Stil: Ein Frame im Spiel, eine Anfrage im Server, ein Zyklus der Regelung. Am Ende wird alles auf einmal verworfen, ohne einzelne Destruktoraufrufe für den Speicher."
    },
    {
      "typ": "multiple-choice",
      "frage": "Welchen Nachteil haben `std::pmr`-Container gegenüber normalen?",
      "optionen": [
        "Jedes Objekt trägt einen zusätzlichen Zeiger auf die Ressource, und Anforderungen laufen über einen virtuellen Aufruf",
        "Sie sind nicht mit Algorithmen der Standardbibliothek kompatibel",
        "Sie können nicht kopiert werden"
      ],
      "korrekt": 0,
      "erklaerung": "Der virtuelle Aufruf kostet wenig im Vergleich zu einer echten Heap-Anforderung, die oft hundert Takte und mehr dauert. Unerwartet für viele: Ein kopierter pmr-Container verwendet standardmässig **nicht** die Ressource des Originals, sondern die Standardressource. Wer gezielt arbeitet, gibt die Ressource beim Kopieren mit.",
      "begruendungen": [
        "Richtig.",
        "Sie funktionieren mit allen Algorithmen und Ranges.",
        "Kopieren ist möglich, aber mit der genannten Besonderheit."
      ]
    }
  ],
  "praxis": "pmr lohnt sich, wenn Allokationen messbar Zeit kosten oder wenn man garantieren muss, dass ein Bereich keinen Heap verwendet: Hochfrequenzhandel, Spiele, Audio, Steuergeräte mit Linux. Auf kleinen Mikrocontrollern ohne Heap sind Container mit fester Kapazität (Modul 7.3) meist einfacher. Ein guter Anfang ist, mit einem Benchmark zu prüfen, ob Allokationen überhaupt ein Problem sind.",
  "labor": {
    "titel": "Benchmark: Heap gegen Arena",
    "anleitung": "Miss mit Google Benchmark, wie lange 10 000 `emplace_back` von kurzen Strings in einen `std::vector<std::string>` und in einen `pmr::vector<pmr::string>` mit monotoner Ressource dauern.",
    "befehle": [
      "g++ -std=c++20 -O2 pmr_bench.cpp -lbenchmark -lpthread -o pmr_bench",
      "./pmr_bench"
    ],
    "beobachtung": "Die Arena-Variante ist häufig mehrfach schneller, vor allem wenn die Strings länger als der SSO-Puffer sind. Bei sehr kurzen Strings ist der Unterschied klein, weil gar nicht alloziert wird."
  },
  "begriffe": [
    { "begriff": "Allokator", "englisch": "allocator", "erklaerung": "Objekt, über das ein Container Speicher anfordert und freigibt." },
    { "begriff": "memory_resource", "englisch": "memory resource", "erklaerung": "Abstrakte Speicherquelle für pmr-Container, zur Laufzeit austauschbar." },
    { "begriff": "Arena", "englisch": "arena allocator", "erklaerung": "Speicherbereich, aus dem fortlaufend verteilt und der als Ganzes freigegeben wird." }
  ],
  "weiterlesen": [
    { "titel": "cppreference: std::pmr::memory_resource", "url": "https://en.cppreference.com/w/cpp/memory/memory_resource" },
    { "titel": "Pablo Halpern: Allocators: The Good Parts (CppCon 2017)", "url": "https://www.youtube.com/watch?v=v3dz-AKOVL8" }
  ]
}
