{
  "id": "p6-m1-l2",
  "phase": 6,
  "modul": "6.1 Der Mikrocontroller",
  "titel": "Memory-mapped I/O und volatile",
  "lernziele": [
    "Erklären, wie Software über Speicheradressen Hardware steuert",
    "Wissen, was `volatile` garantiert und was nicht",
    "Fallen bei Lese-Ändere-Schreibe-Zugriffen auf Register erkennen"
  ],
  "dauerMinuten": 6,
  "schritte": [
    {
      "typ": "code-lesen",
      "frage": "Die Schleife soll warten, bis der Sendepuffer des UART frei ist (Bit 7 im Statusregister). Was kann der Optimierer mit `-O2` daraus machen?",
      "code": {
        "sprache": "cpp",
        "zeilen": [
          "std::uint32_t* const status = reinterpret_cast<std::uint32_t*>(0x40011000);",
          "",
          "while ((*status & (1u << 7)) == 0) {",
          "}"
        ]
      },
      "optionen": [
        "Das Register nur einmal lesen und bei 0 für immer in der Schleife bleiben",
        "Bei jedem Durchlauf neu lesen, wie geschrieben",
        "Die Schleife gar nicht übersetzen, weil Zeiger auf feste Adressen verboten sind"
      ],
      "korrekt": 0,
      "erklaerung": "Für den Compiler ist `*status` normaler Speicher, den in der Schleife niemand ändert. Also darf er den Wert einmal lesen und das Ergebnis wiederverwenden. Dass die **Hardware** den Wert ändert, weiss er nicht. Genau dafür gibt es `volatile`.",
      "begruendungen": [
        "Richtig. Ein typischer Fehler, der nur mit Optimierung auftritt.",
        "Das ist nur mit `volatile` garantiert.",
        "Zeiger auf feste Adressen sind in Embedded-Code normal."
      ]
    },
    {
      "typ": "erklaerung",
      "titel": "Hardware über Adressen steuern",
      "text": "Bei **Memory-mapped I/O** liegen die Register jeder Peripherie an festen Adressen. Schreibt die CPU an `0x4002 0018`, schaltet ein Pin um. Liest sie von `0x4001 1004`, holt sie ein empfangenes Byte aus dem UART. Solche Zugriffe haben **Seiteneffekte**: Lesen kann ein Flag löschen, Schreiben eine Übertragung starten.\n\n`volatile` sagt dem Compiler: Jeder Zugriff auf dieses Objekt ist beobachtbar. Er muss genau so oft und in der Reihenfolge stattfinden, wie er im Code steht, relativ zu anderen `volatile`-Zugriffen. Nichts weglassen, nichts zusammenfassen, nichts zwischenspeichern."
    },
    {
      "typ": "lueckentext",
      "frage": "Ergänze die Deklaration so, dass jeder Zugriff tatsächlich auf das Register geht.",
      "code": {
        "sprache": "cpp",
        "zeilen": ["{{?}} std::uint32_t* const sr = reinterpret_cast<{{?}} std::uint32_t*>(0x40011000);"]
      },
      "luecken": [{ "loesungen": ["volatile"] }, { "loesungen": ["volatile"] }],
      "auswahl": ["volatile", "volatile", "const", "static"],
      "erklaerung": "`volatile` gehört zum Typ, auf den gezeigt wird: `volatile std::uint32_t*`. Das `const` nach dem Stern macht den Zeiger selbst unveränderlich, die Adresse ist ja fest. In der Praxis benutzt man fertige Register-Definitionen des Herstellers (CMSIS), die genau so gebaut sind."
    },
    {
      "typ": "zuordnen",
      "frage": "Was gilt?",
      "paare": [
        { "links": "`volatile` garantiert", "rechts": "Jeder Zugriff findet statt, in Programmreihenfolge relativ zu anderen volatile-Zugriffen" },
        { "links": "`volatile` garantiert nicht", "rechts": "Dass ein Lese-Ändere-Schreibe-Zugriff unteilbar ist" },
        { "links": "Lesen eines Statusregisters", "rechts": "Kann einen Seiteneffekt haben, z. B. ein Flag löschen" },
        { "links": "`std::atomic`", "rechts": "Für Daten, die zwischen Threads oder zwischen ISR und Hauptprogramm geteilt werden" }
      ],
      "erklaerung": "Merke: `volatile` ist für Hardware-Register, `std::atomic` für geteilte Daten (Modul 5.3 und 6.4). Die beiden lösen verschiedene Probleme, und das eine ersetzt das andere nicht."
    },
    {
      "typ": "multiple-choice",
      "frage": "`*odr |= (1u << 5);` setzt Pin 5 eines Ports. Gleichzeitig ändert eine Interrupt-Routine Pin 3 desselben Ports. Was kann schiefgehen?",
      "optionen": [
        "Der Interrupt kommt zwischen Lesen und Schreiben. Danach überschreibt das Hauptprogramm die Änderung an Pin 3 mit dem alten Wert",
        "Nichts, `|=` ist ein einziger Befehl",
        "Der Pin wird doppelt gesetzt"
      ],
      "korrekt": 0,
      "erklaerung": "`|=` ist auf Maschinenebene drei Schritte: lesen, ändern, schreiben. Ein Interrupt dazwischen geht verloren. Viele Mikrocontroller bieten deshalb Set- und Reset-Register wie `BSRR` beim STM32: Ein einziger Schreibzugriff setzt oder löscht genau die gewünschten Bits, ohne vorher zu lesen.",
      "begruendungen": [
        "Richtig.",
        "Im Quelltext ja, in der Hardware nicht.",
        "Das Problem ist nicht Pin 5, sondern der verlorene Wert von Pin 3."
      ]
    },
    {
      "typ": "erklaerung",
      "titel": "Register haben Eigenheiten",
      "text": "Das Referenzhandbuch beschreibt für jedes Bit die Zugriffsart:\n\n- **rw**: lesen und schreiben\n- **r**: nur lesen, Schreiben wirkt nicht\n- **w**: nur schreiben, Lesen liefert z. B. 0\n- **rc_w1**: Schreiben einer 1 löscht das Bit (*write 1 to clear*). Mit `|=` löscht man so versehentlich auch andere gesetzte Flags.\n- **reserviert**: Wert beim Schreiben erhalten bzw. auf den Reset-Wert setzen\n\nWer diese Spalte nicht liest, verbringt Stunden mit Fehlern, die kein Debugger erklärt."
    },
    {
      "typ": "fehler-finden",
      "frage": "Diese Sendefunktion hängt mit `-O2` manchmal für immer. Welche Zeile ist die Ursache?",
      "code": {
        "sprache": "cpp",
        "zeilen": [
          "struct UartRegs { std::uint32_t SR; std::uint32_t DR; };",
          "auto* const uart = reinterpret_cast<UartRegs*>(0x40011000);",
          "",
          "void sende(char c) {",
          "    while (!(uart->SR & (1u << 7))) {}",
          "    uart->DR = static_cast<std::uint8_t>(c);",
          "}"
        ]
      },
      "fehlerZeile": 1,
      "erklaerung": "Die Member der Struktur sind nicht `volatile`. Der Compiler darf `SR` deshalb einmal lesen und in einem Register behalten. Richtig: `struct UartRegs { volatile std::uint32_t SR; volatile std::uint32_t DR; };`, genau wie in den CMSIS-Headern der Hersteller. Zeile 5 ist nur der Ort, an dem sich der Fehler zeigt."
    },
    {
      "typ": "multiple-choice",
      "frage": "C++20 hat `reg++` und `reg += 1` auf `volatile`-Objekten als veraltet markiert. Warum?",
      "optionen": [
        "Sie sehen wie ein Zugriff aus, sind aber ein Lesen und ein Schreiben. Das verschleiert Lese-Ändere-Schreibe-Probleme",
        "Weil `volatile` in C++20 abgeschafft wurde",
        "Weil diese Operatoren auf Mikrocontrollern zu langsam sind"
      ],
      "korrekt": 0,
      "erklaerung": "Die Absicht war, Code ehrlicher zu machen: `reg = reg + 1;` zeigt beide Zugriffe. Nach Rückmeldungen aus der Embedded-Welt hat C++23 die bitweisen Varianten `|=`, `&=` und `^=` wieder erlaubt, weil sie in Register-Code allgegenwärtig sind. `++` und `+=` auf `volatile` bleiben veraltet.",
      "begruendungen": [
        "Richtig.",
        "`volatile` gibt es weiterhin, es ist für Register unverzichtbar.",
        "Die Geschwindigkeit ist gleich, es geht um Klarheit."
      ]
    }
  ],
  "praxis": "Ein fehlendes `volatile` ist ein Klassiker: Im Debug-Build funktioniert alles, im Release-Build hängt das Gerät. Umgekehrt ist `volatile` für Variablen, die zwischen ISR und Hauptprogramm geteilt werden, oft nicht genug. Im Review fragst du deshalb bei jedem `volatile`: Ist das ein Hardware-Register? Wenn nicht, ist `std::atomic` oder ein kritischer Abschnitt meist die richtige Wahl.",
  "labor": {
    "titel": "Den Unterschied im Assembler sehen",
    "anleitung": "Übersetze die Warteschleife einmal mit und einmal ohne `volatile` für Cortex-M4 und vergleiche den erzeugten Code. Am bequemsten geht das im Compiler Explorer (godbolt.org) mit „ARM GCC“.",
    "befehle": [
      "arm-none-eabi-g++ -mcpu=cortex-m4 -mthumb -O2 -S warten.cpp -o -"
    ],
    "beobachtung": "Ohne `volatile` steht das `ldr` (Lesen) vor der Schleife, und die Schleife springt auf sich selbst. Mit `volatile` steht das `ldr` in der Schleife und wird bei jedem Durchlauf ausgeführt."
  },
  "begriffe": [
    { "begriff": "Memory-mapped I/O", "englisch": "memory-mapped I/O, MMIO", "erklaerung": "Peripherie-Register liegen im Adressraum und werden wie Speicher gelesen und geschrieben." },
    { "begriff": "volatile", "englisch": "volatile", "erklaerung": "Jeder Zugriff auf das Objekt ist beobachtbar und muss genau wie im Code stattfinden. Nicht atomar." },
    { "begriff": "Lese-Ändere-Schreibe", "englisch": "read-modify-write", "erklaerung": "Lesen, Ändern und Zurückschreiben eines Werts in getrennten Schritten, die unterbrochen werden können." }
  ],
  "weiterlesen": [
    { "titel": "cppreference: cv (const and volatile) type qualifiers", "url": "https://en.cppreference.com/w/cpp/language/cv" },
    { "titel": "P2327: De-deprecating volatile compound operations", "url": "https://www.open-std.org/jtc1/sc22/wg21/docs/papers/2021/p2327r1.pdf" }
  ]
}
